id,nome,classe,assunto,conteudo
1,INTERNAÇÃO LEITO UTI REDE PRIVADA,,,"ESTADO DO MARANHÃO 
PODER JUDICIÁRIO 
TRIBUNAL DE JUSTIÇA 
SEGUNDA CÂMARA CÍVEL 
 
REMESSA Nº 0800202-33.2021.8.10.0040 – Imperatriz 
Remetente: Juízo da 2ª Vara da Fazenda Pública de Imperatriz 
Requerente: Ministério Público do Estado do Maranhão 
Promotora de Justiça: Samira Merces dos Santos  
1º Requerido: Município de Imperatriz 
Procurador: Bruno Cendes Escórcio  
2º Requerido: Estado do Maranhão 
Procurador: Samuel Mendes Soares Santos  
Relatora: Desembargadora Maria do Socorro Mendonça Carneiro 
 
RELATÓRIO 
 
Trata-se de Remessa Necessária de sentença do Juízo da 2ª Vara da Fazenda Pública da 
Comarca de Imperatriz que, nos autos da presente Ação de Ordinária, ajuizada pelo 
Ministério Público do Estado do Maranhão contra o Município de Imperatriz e Estado do 
Maranhão, julgou procedente a ação para confirmar a determinação de internação da 
autora em leito de UTI da rede pública ou, havendo impossibilidade fática, que 
providenciem a sua internação em leito de UTI na rede privada, a ser paga pelo SUS, sob 
pena de multa de R$ 48.000,00 (quarenta e oito mil reais) para cada um dos entes 
públicos ora requeridos. 
Decisão antecipatória de tutela (ID 12350765). 
Sentença (ID 12350780). 
Parecer da Procuradoria Geral de Justiça, manifestando-se pelo conhecimento e 
desprovimento da remessa (ID 26079068). 
É o relatório. 
Inclua-se em pauta para sessão virtual. 
Publique-se. 
São Luís/MA, data da assinatura eletrônica. 
Desembargadora Maria do Socorro Mendonça Carneiro 
Relatora 
 
VOTO 
 
Inquestionável que o processo teve tramitação regular e que o caso é de remessa 
necessária, a teor do artigo 496, I, do CPC. 
Inicialmente, cumpre registrar que o cumprimento de decisão liminar não tem o condão de 
gerar a extinção do processo pela perda de objeto superveniente, tendo em vista a 
precariedade da medida, sendo necessário o julgamento de mérito, por meio do qual será 
assegurado o provimento final definitivo. 
Ato contínuo, desnecessária a perícia médica, tendo em vista que os documentos que 
acompanham o feito se mostram aptos a demonstrar a situação de saúde da autora, 
considerada grave, eis que com quadro de insuficiência respiratória, e a necessidade de 
internação em leito de UTI. 
A saúde é direito constitucionalmente consagrado a todos, constituindo dever do Estado 
e/ou do Município, nos termos do art. 196, da Constituição Federal, norma esta provida de 
eficácia plena e revestida de aplicabilidade direta, imediata e total. 
A Carta Magna prevê, em seu art. 1º, como um dos seus fundamentos a dignidade da 
pessoa humana, e em seu art. 5º, caput, o direito à vida, o qual deve ser assegurado por 
meio da universalidade da cobertura e do atendimento pela seguridade social (parágrafo 
único, I, do art. 194), além do atendimento integral como diretriz das ações e serviços 
públicos de saúde (art. 198, II).  
Por sua vez, a Lei nº 8.080/90, que regulamenta o Sistema Único de Saúde, em seu art. 
2º, prevê que ""a saúde é um direito fundamental do ser humano, devendo o Estado 
prover as condições indispensáveis ao seu pleno exercício"". 
Nesta esteira, ""O sistema único de saúde, integrado de uma rede regionalizada e 
hierarquizada de ações e serviços de saúde, constitui o meio pelo qual o Poder Público 
cumpre seu dever na relação jurídica de saúde que tem no polo ativo qualquer pessoa e a 
comunidade, já que o direito à promoção e à proteção da saúde é também um direito 
coletivo. O sistema único de saúde implica ações e serviços federais, estaduais, distritais 
(DF) e municipais, regendo-se pelos princípios da descentralização, com prioridade para as 
atividades preventivas, e da participação da comunidade, que confirma seu caráter de 
direito social pessoal, de um lado, e de direito social coletivo, de outro"" (José Afonso Silva, 
""Curso de Direito Constitucional Positivo"", 16ª ed., Malheiros, 1999, p. 805). 
À luz desses preceitos, evidencia-se que todo e qualquer cidadão tem direito à saúde, não 
podendo o Estado, simplesmente, se furtar a tal desiderato.  
Daí que, embora de natureza programática, a norma do art. 196 da CF não pode merecer 
interpretação que, esvaziando seu conteúdo e não lhe conferindo o mínimo de efetividade, 
afaste o dever do Estado (sentido amplo) de garantir assistência médica. Assim, é que os 
dispositivos que determinam o dever estatal em relação à saúde da população são 
autoaplicáveis. 
Com efeito, o Estado do Maranhão e o Município de Imperatriz têm responsabilidade na 
demanda, sendo inteiramente legítima a obrigação de fazer imposta, na medida em que a 
saúde é um direito fundamental do ser humano, cuja garantia compete ao Poder Público, 
a quem cabe prover as condições indispensáveis ao seu pleno exercício, a teor dos citados 
artigos 196 e 197, da Constituição Federal, bem como da Lei nº 8.080/90, que 
regulamenta o Sistema Único de Saúde.  
Como dito acima, os documentos juntados ao feito comprovam a extrema necessidade da 
internação, posto que a autora apresentava quadro grave, diagnosticada com Insuficiência 
Respiratória Aguda, estando em ventilação mecânica (ID 12350763). 
Assim, em consonância com os princípios da razoabilidade e máxima efetividade e da 
dignidade da pessoa humana, não é possível retirar do Poder Público o dever de, no caso 
concreto, assegurar aos requerentes o mínimo existencial, tendo em vista a relevância da 
tutela da saúde pleiteada em face de bem jurídico diverso, de cunho orçamentário. 
O acesso à saúde de forma gratuita constitui direito universal, cabendo ao poder público 
garanti-lo a todos os seus tutelados através de políticas sociais e econômicas. Sem dúvida, 
mesmo que o ente público tenha dificuldades financeiras para satisfazer a sua parte, não 
se pode deixar ao desamparo as pessoas necessitadas. O direito à saúde é garantido a 
todos e deve ser o objetivo principal do poder público. 
Ademais, é cediço que o funcionamento do Sistema Único de Saúde - SUS, previsto no art. 
200 da CF e na Lei nº 8.080, de 19/09/90, é de responsabilidade solidária da União, 
Estados-membros e Municípios, de modo que qualquer dessas entidades tem legitimidade 
ad causam para figurar no polo passivo de demanda que objetiva garantir o acesso à 
saúde. 
Ora, o objeto da presente ação possui cunho social, possibilitando que pessoas carentes 
tenham garantido todo o procedimento necessário à defesa de seu direito consagrado 
constitucional. 
Nesse sentido: 
“APELAÇÃO CÍVEL. DIREITO À SAÚDE. TRATAMENTO DE SAÚDE FORA DE DOMICÍLIO. 
RESPONSABILIDADE SOLIDÁRIA DE TODOS OS ENTES DA FEDERAÇÃO. ARTIGOS 23, II e 
196, DA CONSTITUIÇÃO FEDERAL. PRECEDENTES. RESERVA DO POSSÍVEL. 
INAPLICABILIDADE. SENTENÇA MANTIDA. 1 - Comprovada a necessidade do tratamento 
médico, bem como a carência financeira para custeá-la, é dever do ente público o 
fornecimento, garantindo as condições de saúde e sobrevivência dignas, com amparo nos 
artigos 196 e 197 da Constituição Federal. 2 - É inegável a preponderância do direito à 
saúde, assegurado pela Constituição Federal, frente ao princípio da reserva do possível, 
cuja aplicação, tem sido relativizada pelo Supremo Tribunal Federal, em situações como a 
dos autos. 3 – O Estado do Maranhão não demonstrou que, instado a fornecer o TFD, 
tenha sequer nomeado a comissão médica de que trata a Portaria regulatória, a fim de 
viabilizar à criança a sua submissão aos procedimentos exigidos. O Estado recorrente 
sequer apresentou contestação nos autos, em nada contribuindo para infirmar as 
alegações da autora sobre a omissão estatal na garantia do seu direito à vida e saúde. 4 - 
Apelo conhecido e não provido.” (ApCiv 0162642018, Rel. Desembargador(a) JAMIL DE 
MIRANDA GEDEON NETO, TERCEIRA CÂMARA CÍVEL, julgado em 20/09/2018, DJe 
27/09/2018). 
 
“APELAÇÃO CÍVEL - AÇÃO COMINATÓRIA - PRELIMINAR DE ILEGITIMIDADE DA PARTE - 
REJEITADA - FORNECIMENTO DE TRATAMENTO ADEQUADO AO CIDADÃO QUE 
NECESSITA - OBRIGAÇÃO CONSTITUCIONAL - ART. 196 DA CF - RECURSO IMPROVIDO. 
(...) O artigo 196 da Constituição Federal prescreve que é dever do Estado garantir o 
acesso universal e igualitário das pessoas à saúde, estando este dever constitucional 
acima de qualquer lei, portaria ou qualquer outro ato normativo, porquanto o que se visa 
garantir é o direito primordial à vida. Comprovada a necessidade de realização de 
procedimento cirúrgico, prescrito por médico habilitado, além do fato de que o portador da 
enfermidade não possui condições econômicas de suportar os custos do tratamento, deve 
o Estado fornecer o medicamento, porquanto todas as pessoas têm direito à saúde."" 
(TJMS - Apelação Cível - Rel Des. Rubens Bergonzi Bossay - 3ªTC - J: 01/07/2009) 
 
“CONSTITUCIONAL. DIREITO À SAÚDE. PROCESSUAL CIVIL. ANTECIPAÇÃO DE TUTELA 
CONTRA A FAZENDA PÚBLICA. LEI nº 9.494/97. POSSIBILIDADE. 1. (...) 2. REALIZAÇÃO 
DE CIRURGIA. FORNECIMENTO DE MEDICAÇÃO. LEGITIMIDADE PASSIVA. 
responsabilidade solidária de todos os entes da federação. artigos 23, II e 196, 
constituição federal. Precedentes. IRRELEVÂNCIA DE O MEDICAMENTO OU 
PROCEDIMENTO NÃO ESTAR PREVISTO EM LISTA. JURISPRUDÊNCIA PACIFICADA. De 
acordo com firme orientação do Supremo Tribunal Federal e do Superior Tribunal de 
Justiça, o direito à saúde é dever do Estado, lato sensu considerado, a ser garantido modo 
indistinto por todos os entes da federação – União, Estados, Distrito Federal e Municípios – 
forte nos artigos 23, II e 196 da Constituição Federal, sendo irrelevante, no mais, a 
circunstância do fármaco ou procedimento não integrar a lista de competência do ente 
estatal demandado. CONDIÇÃO ECONÔMICA. PARTE AUTORA. IMPOSSIBILIDADE 
FINANCEIRA DE ARCAR COM OS CUSTOS DA CIRURGIA DEMONSTRADA. O fato de a 
parte autora vir a juízo pleitear a realização de cirurgia gera presunção quanto à 
necessidade e impossibilidade financeira de arcar com seus custos, caso em que tais 
circunstâncias restaram devidamente comprovadas nos autos, estando litigando sob o 
pálio da gratuidade de justiça. (...) PRINCÍPIO DA RESERVA DO POSSÍVEL. 
INAPLICABILIDADE. PRECEDENTE DO SUPREMO TRIBUNAL FEDERAL. É inegável a 
preponderância do direito à saúde, assegurado pela Constituição Federal, frente ao 
princípio da reserva do possível, cuja aplicação, tem sido relativizada pelo Supremo 
Tribunal Federal, em situações como a dos autos. INSUFICIÊNCIA DE VERBA 
ORÇAMENTÁRIA. AUSÊNCIA DE COMPROVAÇÃO. PREVALÊNCIA DO DIREITO À SAÚDE 
(ART. 196, CF). A alegada insuficiência de verba orçamentária, a par de ceder ante a 
prevalência do direito à saúde, assegurado pelo art. 196, CF/88, não restou comprovada 
nos autos.” (TJRS, AJALR Nº 70045020260 2011/Cível, Rel. Des. Arminio José Abreu Lima 
da Rosa, 13 de setembro de 2011) 
Assim sendo, comprovada a necessidade da realização do tratamento por pessoa carente, 
compete aos entes públicos fornecê-lo, não se podendo permitir que a burocracia e as 
dificuldades financeiras desses entes estatais vençam o direito à saúde, que se sobrepõe 
aos demais valores juridicamente considerados. 
O direito à vida é à saúde é o maior e o primeiro dos direitos assegurados pela Carta 
Magna, de modo que a vida do paciente deve prevalecer sobre o aspecto monetário. 
Desse modo, não há também que se falar em ofensa ao chamado princípio da reserva do 
possível, pois a existência de limitação de valores ou de serviços não tem o condão de 
afastar a obrigação constitucionalmente imposta ao município, reforçada diante da 
circunstância deste de não haver demonstrado o comprometimento do seu orçamento.  
Nesse sentido é a orientação do Superior Tribunal de Justiça, inclusive admite o bloqueio 
de verbas públicas, com vistas a conferir efetividade à proteção ao direito à saúde: AgRg 
no Ag n. 1.044.354/RS, LUIZ FUX; AgRg no Ag 961677/SC, ELIANA CALMON; REsp n. 
1.058.836/RS, MAURO CAMPBELL MARQUES; AgRg no REsp n. 1.033.825/RS, HERMAN 
BENJAMIN. 
Posto isto, de acordo com o parecer ministerial, voto pelo conhecimento e desprovimento 
da remessa, com manutenção da sentença. 
Advirto às partes que eventuais embargos para rediscutir questões já decididas, ou 
mesmo para prequestionamento, poderão ser considerados protelatórios, sujeitos à 
aplicação de multa, nos termos do art. 1.026, § 2º, do CPC. 
 
Desembargadora Maria do Socorro Mendonça Carneiro 
Relatora"
2,CIRURGIA REPARADORA - CLAUSULA ABUSIVA,,,"ESTADO DO MARANHÃO 
PODER JUDICIÁRIO 
TRIBUNAL DE JUSTIÇA 
PRIMEIRA CÂMARA DE DIREITO PRIVADO 
 
APELAÇÃO CÍVEL Nº 0871723-87.2023.8.10.0001 – São Luís 
Apelante: Bradesco Saúde S/A 
Advogado: Reinaldo Luís Tadeu Rondina Mandaliti (OAB/MA 11706-A) 
Apelado: D. P. A de A. N., por Raissa Pereira Alves de Azevedo Neves 
Advogado: Luiz Eduardo Santos Jacintho da Graça (OAB/MA 24496) 
Relatora: Desembargadora Maria do Socorro Mendonça Carneiro 
 
EMENTA: PROCESSO CIVIL. CIVIL. SEGURO DE SAÚDE. CLÁUSULAS ABUSIVAS. CIRURGIA 
REPARADORA. OTOPLASTIA. CLÁUSULA DE EXCLUSÃO. INTERPRETAÇÃO FAVORÁVEL AO 
CONSUMIDOR. AUSÊNCIA DE COMPROVAÇÃO DE DESEQUILÍBRIO CONTRATUAL PELA 
OPERADORA. MANUTENÇÃO SENTENÇA. DESPROVIMENTO APELO. 
1. Afastada a natureza estética da Otoplastia indicada para o autor da demanda, tendo em 
vista os transtornos psicossociais decorrentes da malformação das orelhas, que são 
consequências de intimidação constante e abusiva, inclusive com a necessidade de 
acompanhamento psicológico em razão das dificuldades de manutenção de relações 
sociais. 
2. Conquanto seja próprio dos contratos de seguro ou planos de saúde o risco, tal instituto 
não sobressai à boa-fé dos beneficiários. Cuida-se de contrato de adesão, no qual não é 
possibilitado aos futuros beneficiários imiscuírem-se na discussão das cláusulas, fazendo 
uso, tão-somente, de sua boa-fé. 
3. As cláusulas contidas nos contratos firmados devem guardar uma relação de 
proporcionalidade entre as partes, de sorte que restarão nulas as condições que levem o 
segurado à situação exageradamente desvantajosa em relação à seguradora, conforme 
inteligência do art. 51, inciso IV, do Código de Defesa do Consumidor.  
4. Apelo conhecido e desprovido. 
 
DECISÃO 
 
Trata-se de Apelação Cível interposta por Bradesco Saúde S/A objetivando a reforma da 
sentença do Juízo da 10ª Vara Cível da Capital, proferida pelo NAUJ - Núcleo de Apoio às 
Unidades Judiciais, e que, nos autos da presente ação ordinária proposta pelo apelado, 
acolheu os pedidos iniciais, condenando-o ao pagamento do reembolso do valor da 
cirurgia e de indenização por danos morais, além das custas e honorários advocatícios (ID 
39188863).  
Em suas razões recursais (ID 39188865), o apelante sustenta, em síntese, que o autor 
apelado aderiu ao plano de saúde, com cláusulas e condições expressamente pré-
estabelecidas e que prescrevem, com clareza, as condições para cobertura/reembolso de 
despesas, portanto, não lhe caberia custear tratamentos não previstos no rol exaustivo da 
ANS, sob pena violação à liberdade contratual das partes. Ressaltando, ainda, que a 
otoplastia é um procedimento estético, não se classificando como procedimento funcional, 
logo, não sendo obrigatória a sua cobertura.  
Ao fim, requer a reforma da sentença, com a improcedência da ação, e alternativamente, 
pede a redução da indenização por danos morais.  
Contrarrazões (ID 39188871). 
Parecer da Procuradoria Geral de Justiça, manifestando-se pelo conhecimento e 
desprovimento do recurso (ID 40958914). 
É o relatório. Decido. 
Presentes os requisitos de admissibilidade recursal. 
Trata a lide acerca da possibilidade do plano de saúde recusar o reembolso das despesas 
médico-hospitalares referentes à cirurgia de otoplastia realizada pelo autor, sob o 
fundamento de que o procedimento não está previsto no rol da ANS e se trata de cirurgia 
estética, não coberta pelo plano de saúde, bem como acerca do dever de indenizar 
decorrente da má prestação de serviço.  
A relação jurídica estabelecida entre as partes é de consumo e a ela, portanto, se aplica o 
Código de Defesa do Consumidor, haja vista as partes se inserirem no conceito de 
fornecedor e consumidor, consagrados em seus artigos 2º e 3º. 
Ademais, dispõe expressamente a Súmula nº 469 do Superior Tribunal de Justiça: ""Aplica-
se o Código de Defesa do Consumidor aos contratos de plano de saúde"". 
Primeiramente, a alegação da ocorrência de prescrição anual deve ser afastada, eis que 
nas demandas de reembolso dos beneficiários, não há que se falar em obrigação negocial 
ou reparatória, haja vista que não buscam, respectivamente, a execução específica do 
contrato ou reparação de dano injusto. Sendo assim, o objetivo seria propriamente o 
ressarcimento de enriquecimento sem causa. 
Afinal, na prática, não se busca o fornecimento ou custeiro de produto ou procedimento, 
pois estes já foram alcançados com recursos próprios do paciente, mas sim a restituição 
dos valores indevidamente pagos, o que atrai a regra insculpida no art. 206, § 3º, IV do 
CC, logo, o prazo prescricional é o trienal.  
Com relação à irresignação do apelante quanto ao processo correr em segredo de justiça, 
cumpre consignar que, embora os atos processuais sejam públicos, todavia, tramitam em 
segredo de justiça os processos em que o exija o interesse público ou social; que versem 
sobre casamento, separação de corpos, divórcio, separação, união estável, filiação, 
alimentos e guarda de crianças e adolescentes, bem como nos processos em que constem 
dados protegidos pelo direito constitucional à intimidade (CPC, art. 189).  
Por outro lado, o ECA é claro ao definir que a promoção dos direitos e proteção da criança 
e do adolescente deve ser efetuada no respeito pela intimidade, direito à imagem e 
reserva da sua vida privada (art. 100, V), portanto, tendo em vista que os documentos 
carreados aos autos tratam da intimidade e da vida privada de menores, incluindo laudos 
médicos psicológicos e informações sensíveis aos infantes envolvidos em atos de assédio 
psicológico realizados no interior de instituição privada de ensino, o segredo de Justiça é 
medida que se impõe. 
No mérito, quanto ao custeio de procedimentos cirúrgicos e materiais indicados pelo 
médico responsável, registre-se que o CDC traz normas de conduta gerais e estabelece 
princípios que devem ser obedecidos em toda relação de consumo.  
É norma de função social, que goza de índole constitucional. Desta forma, a Lei 9656/98 e 
as Resoluções da ANS não têm o poder de suprimir direitos assegurados pelo CDC. 
Desta feita, as cláusulas limitativas ou obstativas das obrigações assumidas pelas 
seguradoras de saúde devem ser interpretadas à luz da boa-fé objetiva e sempre da 
maneira mais favorável ao consumidor, em razão da sua presumida vulnerabilidade e do 
caráter cogente do CDC, em consonância com o disposto no artigo 47 (“As cláusulas 
contratuais serão interpretadas de maneira mais favorável ao consumidor""). 
In casu, incontroversa a recusa do réu na realização da cirurgia de otoplastia (ID 
39188814), sob alegação de se tratar de procedimento estético, sem cobertura contratual, 
entretanto, consta do acervo probatório, que o adolescente beneficiário do plano de saúde 
(ID 39188810) começou a sofrer bullying na escola por causa do tamanho de suas orelhas 
(ID 39188811), o que trouxe consequências psíquicas e emocionais graves, sendo 
recomendado, a par do acompanhamento terapêutico/psicológico, a realização de 
procedimento cirúrgico para corrigi-las.  
Importante ressaltar o relatório psicológico acostado (ID 39188812), que reforça a 
ocorrência de assédio sofrida pelo menor, com comentários depreciativos acerca de suas 
orelhas, o que trouxe consequências nefastas ao seu equilíbrio emocional, relacionamento 
social e desempenho escolar, levando-o inclusive a mudar de escola. 
Assim, correta a sentença ao condenar o réu a promover o reembolso dos valores gastos 
para a realização da cirurgia por meios próprios, diante da negativa do plano de saúde, 
bem como ao pagamento de indenização por danos morais, vez que a parte ré não se 
desincumbiu do ônus de comprovar a regularidade da prestação do serviço, a teor do art. 
373, II, do CPC. 
No caso concreto, a recusa em cobrir o custo da cirurgia, sob o argumento de se tratar de 
procedimento cirúrgico estético, mostrou-se abusiva, uma vez que o procedimento está 
ligado diretamente à integridade psíquica da demandante, também objeto do contrato de 
plano de saúde. 
Assim, afigura-se descabida e afronta o princípio fundamental da dignidade da pessoa 
humana e o direito à saúde e à vida. Não se mostra ético ou de acordo com os postulados 
da boa-fé e da confiança, questionar a necessidade da utilização dos serviços quando está 
em jogo a integridade física/psíquica ou a vida de um ser humano. 
Destaque-se que a questão ultrapassa ao mero inadimplemento contratual, este que se 
relaciona aos direitos patrimoniais disponíveis, uma vez que, versando a contratação 
relativamente à saúde, incorpora direitos fundamentais regulados constitucionalmente, 
merecendo tratamento diferenciado em face das consequências nefastas decorrentes da 
inadimplência da prestadora. 
A angústia e o sofrimento por que passou o demandante são indubitáveis, sendo 
agravados face à inércia da parte ré em autorizar o procedimento apontado na inicial, 
gerando constrangimento e abalo emocional que fogem à normalidade da vida cotidiana. 
Conclui-se, assim, que a recusa fere os princípios do Código de Defesa do Consumidor e 
deve ser vista como desequilíbrio contratual que deixa o consumidor, parte frágil da 
relação, em desvantagem exagerada, passando por percalços e angústias desnecessárias. 
Inegável, portanto, a falha na prestação do serviço por parte da ré, a ensejar indenização 
por danos morais. 
Com relação ao valor da reparação, apesar de a legislação não estabelecer critérios 
objetivos, devem ser observados os princípios da razoabilidade e da proporcionalidade, de 
modo a não gerar enriquecimento indevido, logo, o valor deve ser mantido no montante 
de R$ 5.000,00 (cinco mil reais), pois de acordo com os princípios da razoabilidade e da 
proporcionalidade e com os precedentes desta Corte. 
Posto isso, na forma da fundamentação supra, e em consonância com o parecer 
ministerial, conheço e nego provimento ao recurso. 
 
Desembargadora Maria do Socorro Mendonça Carneiro 
Relatora"
