id,nome,classe,assunto,conteudo
10,DANOS MORAIS ERRO MÉDICO,,,"ESTADO DO MARANHÃO 
PODER JUDICIÁRIO 
TRIBUNAL DE JUSTIÇA 
SEGUNDA CÂMARA CÍVEL 
 
APELAÇÃO CÍVEL Nº 0801238-86.2020.8.10.0027 – Barra do Corda 
Apelante: Maria Zenir da Frota 
Advogados: José Carlos Rabelo Barros Júnior (OAB/MA 13429) e outro 
Apelado: Município de Barra do Corda 
Advogados: Emanuely Abreu Lima Lôbo (OAB/MA 15699) e outros 
Relatora: Desembargadora Maria do Socorro Mendonça Carneiro 
 
RELATÓRIO 
 
Trata-se de Apelação Cível interposta por Maria Zenir da Frota contra sentença do Juízo da 
1ª Vara da Comarca de Barra do Corda que, nos autos da presente Ação de Indenização 
por Danos Morais e Materiais, ajuizada contra o ora apelado Município de Barra do Corda, 
julgou-a parcialmente procedente para condenar o réu ao pagamento de indenização por 
danos morais de R$ 25.000,00 (vinte e cinco mil reais). 
Sentença (ID 12213304). 
Em suas razões recursais (ID 12213307), a apelante requer a inclusão dos lucros 
cessantes na condenação e a majoração dos danos morais para o importe de 
R$ 100.000,00 (cem mil reais) e dos honorários advocatícios.  
Contrarrazões (ID 12213311) 
Parecer da Procuradoria Geral de Justiça, manifestando-se pelo conhecimento e parcial 
provimento do recurso, para que sejam majorados os danos morais (ID 25682937). 
É o relatório. 
Inclua-se em pauta para sessão virtual. 
Publique-se. 
São Luís/MA, data da assinatura eletrônica. 
 
Desembargadora Maria do Socorro Mendonça Carneiro 
Relatora 
 
VOTO 
Presentes os pressupostos de admissibilidade, conheço do presente recurso. 
O cerne da inconformação recursal refere-se à reforma da sentença, a fim de que seja 
incluída na condenação os alegados lucros cessantes decorrentes do período em que a 
apelante ficou impossibilitada de trabalhar em razão do erro médico, bem como para que 
a indenização por danos morais e os honorários sucumbenciais sejam majorados. 
Primeiramente, importante contextualizar os fatos que ensejaram o pedido inicial de danos 
materiais e morais decorrentes de responsabilidade civil do ente municipal requerido por 
falha na prestação do serviço público de saúde. 
Assim, extrai-se dos autos que a autora tendo recorrido à rede pública municipal de 
saúde, após a realização, em 01/02/2018, de exames clínicos, foi constatada a existência 
de cisto ovariano (ID 12213291). E que, em 09/03/2018, o médico do município, Dr. 
Adriano Aragão Brandes (CRM/MA 6425), feitos os exames pré cirúrgicos (ID 12213292), 
realizou a intervenção para retirada do Cisto no Ovário Direito (ooforectomia) no Hospital 
Municipal Acrísio Figueira. 
Consta que, por persistirem os mesmos sintomas mesmo após a cirurgia, a autora 
apelante buscou novamente auxílio médico em 26/09/2018, submetendo-se novamente à 
ultrassonografia, e descobrindo então a persistência do cisto no ovário direito, inclusive 
com aumento de tamanho. Ainda, surpreendentemente, constatou-se que o ovário 
esquerdo, outrora saudável, havia sido retirado indevidamente na cirurgia (ID 12213294), 
demonstrando claro erro médico.  
Ao buscar a rede pública municipal para receber explicações, foi informada que teria que 
se submeter novamente à cirurgia para retirada do ovário direito, sendo confirmado em 
novo exame clínico, datado de 03/10/2019, o cisto hemorrágico no ovário direito, bem 
como a ausência do ovário esquerdo (ID 12213295). 
Não há dúvida, portanto, pela prova dos autos, de que a autora foi vítima de erro médico 
crasso, que a mutilou, extraindo órgão saudável e obrigando-a a submeter-se novamente 
a procedimento cirúrgico, com todos os riscos envolvidos e, pior, com consequências 
danosas e irreversíveis à sua saúde e bem-estar. 
Sabe-se que a responsabilidade civil do Estado (sentido amplo) por danos que seus 
agentes tenham eventualmente causado a terceiros, em regra, é objetiva (art. 37, § 6º da 
Constituição Federal), sendo observada a teoria do risco administrativo, segundo a qual 
não se perquire a culpa, mas sim o nexo de causalidade entre o serviço público oferecido 
e o dano sofrido pelo administrado, devendo ser verificada a ocorrência dos seguintes 
elementos: i) ato ilícito praticado pelo agente público; ii) dano específico ao administrado; 
e iii) nexo de causalidade entre a conduta e o dano. Não configurados quaisquer desses 
requisitos, deve ser afastada a responsabilidade civil do Estado. 
No caso de suposto erro médico na rede de saúde do Município, entretanto, a 
responsabilidade é subjetiva, fundada na teoria da “falta do serviço”, sendo imprescindível, 
portanto, a comprovação da conduta imprudente, negligente ou inábil do profissional a 
justificar o dever de reparar os danos eventualmente provocados aos pacientes. 
Assim sendo, a controvérsia dos autos consiste em verificar se a equipe médica 
responsável pela cirurgia da autora agiu com negligência e/ou imperícia, bem como se 
houve nexo de causalidade entre a atuação destes e a perda de órgão saudável da autora 
e, em caso positivo, a configuração de dano moral e material. 
É cediço ser a obrigação do profissional médico, em regra, de meio, não de resultado. Em 
alguns casos, mesmo o profissional sendo diligente e empregando todos os recursos ao 
seu alcance em prol do paciente, pode haver complicações indesejadas, apesar de 
previstas; em outros, fatores individuais do paciente podem causar complicações, sem que 
haja qualquer relação de causa e efeito com a atuação da equipe médica. 
Na hipótese, os documentos colacionados aos autos demonstram que de fato houve 
negligência e imperícia da equipe que realizou a cirurgia de retirada de cisto ovariano na 
vítima. 
Ora, conforme prontuário médico e exames pré cirúrgicos, a apelante não possuía 
problema grave de saúde, apenas há registro do citado cisto no ovário direito, situação 
que justificou a realização da cirurgia para sua retirada. A paciente foi internada em bom 
estado de saúde e, em contrapartida, após a cirurgia verificou a persistência dos sintomas 
que a fizeram buscar atendimento médico. 
Também não há dúvidas que foi retirado, indevidamente, o ovário esquerdo (saudável), o 
que a obrigou a submeter-se a nova cirurgia, e a sofrer as consequências permanentes de 
ficar sem os dois ovários (o doente e o saudável). 
Percebe-se, com base no elucidado, a clara ocorrência de erro médico na hipótese, 
caracterizada pela imperícia técnica na etapa cirúrgica referente à extração do cisto no 
ovário direito, bem como a indevida extração do outro ovário sadio, não tendo o apelado 
trazido NADA que desconstituísse tais fatos e provas. 
Nesse sentido: 
APELAÇÃO. RESPONSABILIDADE CIVIL. NÃO CONHECIMENTO. SERVIÇO NA REDE 
PÚBLICA DE SAÚDE. ERRO MÉDICO. NÃO COMPROVAÇÃO. PROCEDIMENTO ADEQUADO. 
NEXO DE CAUSALIDADE AFASTADO. PEDIDO INDENIZATÓRIO. INVIABILIDADE. 
1. A responsabilidade do Estado por erro médico é, em regra, subjetiva, sendo 
indispensável a prova de que, por inobservância do dever de cuidado objetivo, os 
profissionais de saúde do Poder Público deixaram de adotar as técnicas adequadas para o 
melhor tratamento da saúde dos pacientes. Além disso, é necessária a demonstração do 
nexo de causalidade entre a conduta e o dano. 
2. A falta da comprovação da ocorrência de erro médico acaba por afastar o nexo de 
causalidade entre o serviço prestado pelos médicos da rede pública de saúde do Distrito 
Federal e o dano moral alegado pela Autora. 
3.Negado provimento ao recurso. Unânime. (Acórdão n.1021978, 20140111895305APC, 
Relator: ROMEU GONZAGA NEIVA 7ª TURMA CÍVEL, Data de Julgamento: 24/05/2017, 
Publicado no DJE: 06/06/2017. Pág.: 887-900) 
Ademais, tratando-se de típica relação de consumo, o artigo 22 do Código de Defesa do 
Consumidor dispõe que “os órgãos públicos, por si ou suas empresas, concessionárias, 
permissionárias ou sob qualquer outra forma de empreendimento, são obrigados a 
fornecer serviços adequados, eficientes, seguros e, quanto aos essenciais, contínuos”. Já o 
parágrafo único desse dispositivo prevê que “nos casos de descumprimento, total ou 
parcial, das obrigações referidas neste artigo, serão as pessoas jurídicas compelidas a 
cumpri-las e a reparar os danos causados, na forma prevista neste código”. 
Nesse panorama, caracterizada a culpa por conduta imperita e negligente da equipe do 
Hospital Municipal Acrísio Figueira na realização da cirurgia, com inafastável nexo causal 
entre a falha e os danos decorrentes, quais sejam, risco cirúrgico aumentado com a 
realização de duas cirurgias no lugar de uma, e a perda de órgão saudável, o qual têm 
duas funções: produção dos hormônios sexuais femininos (progesterona e estrogênio) e 
produção e armazenamento dos óvulos, que são liberados um a cada mês e recolhidos 
pelas tubas uterinas, enquanto durar a vida reprodutiva da mulher.  
De ressaltar, neste contexto, tratar-se de paciente à época com 37 (trinta e sete) anos, 
portanto, restou prejudicada sua fertilidade, com antecipação, inclusive, da menopausa, 
além da perda da qualidade de vida e do seu bem-estar geral. 
Configurados os elementos da responsabilidade civil do Estado, que não atuou de forma 
como deveria para evitar a ocorrência do fato, causando danos à honra objetiva da 
demandante, fazendo jus à reparação dos danos morais suportados. 
Comprovada a existência de danos extrapatrimoniais, in re ipsa, a reparação, em tais 
circunstâncias, reside no pagamento de um valor, que possibilite ao lesado uma satisfação 
compensatória pelo constrangimento e ofensa a sua honra e dignidade, além do caráter 
dissuasório e preventivo.  
Assim, com relação à fixação do quantum indenizatório, diante da ausência de critérios 
legalmente definidos, deve o julgador, atento às finalidades compensatória, punitiva e 
preventivo-pedagógica da condenação, guiado pelos princípios gerais da prudência, bom 
senso, proporcionalidade e razoabilidade, estabelecer valor que se mostre adequado às 
circunstâncias que envolveram o fato e compatível com o grau e a repercussão da ofensa 
moral discutida. 
Importante, desse modo, considerar a preocupação de não se permitir que a reparação se 
transforme em fonte de renda indevida para o lesado ou se apresente parcimoniosa a 
ponto de passar despercebida pela parte ofensora. 
Dispõe o artigo 944 do Código Civil que “a indenização mede-se pela extensão do dano”, 
logo, o valor arbitrado na sentença — R$ 25.000,00 (vinte e cinco mil reais) — mostra-se 
insuficiente a satisfazer a justa proporcionalidade entre a conduta e o dano moral sofrido, 
levando-se em conta a gravidade do ocorrido, o sofrimento e a angústia experimentados 
pela autora, em razão da perda de um órgão saudável e, por outro viés, a conduta na 
modalidade culposa do réu (art. 954, caput e 953, parágrafo único, CC). 
Transportando estes comandos ao caso dos autos, pautando-se nos parâmetros da 
proporcionalidade e razoabilidade e impondo a reparação de forma adequada, entendo 
que o quantum indenizatório deve ser majorado para o valor de R$ 50.000,00 (cinquenta 
mil reais), suficiente a compensar a vítima pelos transtornos sofridos e danos irreversíveis 
sofridos. 
Por outro lado, com relação ao pedido de indenização por danos materiais, verifica-se não 
haver prova dos pretendidos lucros cessantes, eis que a mera alegação de que a autora é 
lavradora, de per si, não evidencia a perda remuneratória alegada, devendo haver 
inequívoca prova desta para que possa haver a reparação pretendida, portanto, não tendo 
cumprido a autora apelante com o ônus que lhe impõe o art. 373, I, do CPC, deve ser 
mantido o indeferimento de tal pleito.  
Por fim, o percentual fixado para os honorários sucumbenciais, igualmente, deve ser 
mantido, posto que em consonância com os parâmetros do art. 85, § 2º, do CPC. 
Posto isso, voto pelo conhecimento e parcial provimento do recurso para, na forma da 
fundamentação supra, majorar a indenização por danos morais para o importe de 
R$ 50.000,00 (cinquenta mil reais), mantidos os demais termos da sentença. 
No sentido de evitar a oposição de Embargos de Declaração, considera-se, desde já, 
prequestionada toda matéria infraconstitucional e constitucional aduzidas nos autos, 
“sendo desnecessária a pormenorização de cada dispositivo, haja vista a questão jurídica 
abordada e decidida” (RT 703/226, Min. Marco Aurélio) e C. STJ (AgRg no REsp 
1.417.199/RS, Relª. Minª. Assusete Magalhães), advertindo-se às partes que eventuais 
embargos para rediscutir questões já decididas, ou mesmo para prequestionamento, 
poderão ser considerados protelatórios, sujeitos à aplicação de multa, nos termos do art. 
1.026, §2º do CPC. 
 
 
Desembargadora Maria do Socorro Mendonça Carneiro 
Relatora"
11,COBERTURA DE ATENDIMENTO URGÊNCIA - PRAZO DE CARÊNCIA,,,"ESTADO DO MARANHÃO 
PODER JUDICIÁRIO 
TRIBUNAL DE JUSTIÇA 
PRIMEIRA CÂMARA DE DIREITO PRIVADO 
 
APELAÇÃO CÍVEL N°0847132-61.2023.8.10.0001 - São Luís 
1º Apelante/2º Apelado: Gustavo Reis Castro, por Flávia D’Eça Serra Reis 
Advogado: Fernando Abreu Araújo (OAB/MA 8213) 
1ª Apelada/2ª Apelante: Gama Saúde Ltda. 
Advogado: Gustavo Antônio Feres Paixão (OAB/MA 19405-A) 
1ª Apelada: UNIPACTUM Administradora de Benefícios Ltda.  
Advogada: Alessandra do Lago (OAB/SP 138081) 
1ª Apelada: CEAM Brasil Planos de Saúde Ltda. 
Advogado: Wagner Duccini (OAB/SP 258875) e outros 
Relatora: Desembargadora Maria do Socorro Mendonça Carneiro  
 
EMENTA 
PROCESSUAL CIVIL E CONSUMIDOR. APELAÇÃO CÍVEL. PLANO DE SAÚDE. NEGATIVA DE 
COBERTURA DE ATENDIMENTO DE URGÊNCIA. PRAZO DE CARÊNCIA PARA 
ATENDIMENTO EMERGENCIAL. 24 HORAS. LIMITAÇÃO DA INTERNAÇÃO POR 12 HORAS. 
CARÁTER ABUSIVO. INTELIGÊNCIA DOS ARTIGOS 12, V, ALÍNEA C, E 35-C, I, LEI N.º 
9.656/98. SÚMULAS 302 E 597 DO STJ. RECURSOS CONHECIDOS. PROVIMENTO 1º. 
DESPROVIMENTO 2º ESPECIAL DESPROVIDO.  
1. ""É abusiva a cláusula contratual de plano de saúde que limita no tempo a internação 
hospitalar do segurado"" (Súmula 302/STJ). 
2. ""A cláusula contratual de plano de saúde que prevê carência para utilização dos serviços 
de assistência médica nas situações de emergência ou de urgência é considerada abusiva 
se ultrapassado o prazo máximo de 24 horas contado da data da contratação"" (Súmula 
597/STJ). 
3. Configurada a falha na prestação do serviço, pela negativa de cobertura de plano de 
saúde no atendimento de urgência/emergência, quando já decorrido o prazo de carência 
de 24 h para urgência e emergência configura dano moral presumido e, portanto, passível 
de indenização. 
4. Patente é o dever de indenizar pelo dano moral suportado, observados os Princípios da 
Proporcionalidade e da Razoabilidade e, ainda, ao caráter punitivo-pedagógico da 
indenização.  
5. Apelos conhecidos. Provimento 1º. Desprovimento 2º. 
 
DECISÃO 
 
Tratam-se de Apelações Cíveis interpostas contra sentença do Juízo da 11ª Vara Cível da 
Capital que, nos autos da presente Ação de Obrigação de Fazer c/c Reparação de Danos, 
julgou-a parcialmente procedente para, confirmando a liminar concedida, condenar os 
requeridos, solidariamente ao pagamento das custas e honorários advocatícios de 10% 
(dez por cento) do valor atualizado da causa (IDs 39491832 e 39491835).  
Em suas razões (ID 39491839), o 1º Recorrente pretende a reforma da sentença, para 
que seja incluída na condenação a indenização por danos morais, pela indevida negativa 
de cobertura em situação emergencial que, por lei, tem carência de apenas 24 (vinte e 
quatro) horas. 
A 2ª recorrente, Gama Saúde Ltda., sustenta a inexistência de falha na prestação do 
serviço ou conduta abusiva na negativa da internação, haja vista que esta não se incluiria 
na cobertura de urgência/emergência, portanto, descabida a condenação na obrigação de 
fazer, devendo ser reformada a sentença com improcedência da ação (ID 39491840) 
Contrarrazões da UNIPACTUM Administradora de Benefícios Ltda. ao 1º apelo (ID 
39491844). 
Contrarrazões da CEAM Brasil Planos de Saúde Ltda. ao 1º apelo (ID 39491846). 
Contrarrazões ao 2º apelo (ID 39491847). 
Nas suas razões (ID 35104169), a 2ª apelante defende a regularidade da contratação, 
pugnando apenas pela majoração do valor da indenização por danos morais, para o 
patamar de R$ 15.000,00 (quinze mil reais). 
Contrarrazões ao 2º apelo (ID 35104173). 
A Procuradoria de Justiça, por meio de parecer(ID 35717735), manifestou-se pelo 
conhecimento dos recursos, com desprovimento do 2º e parcial provimento do 1º, 
reconhecendo-se a ocorrência dos danos morais e fixando-os em R$ 10.000,00 (dez mil 
reais). 
É o relatório. Decido. 
Presentes os pressupostos objetivos de admissibilidade, os apelos devem ser conhecidos. 
A questão controvertida diz respeito a obrigação de fazer com pleito compensatório por 
dano moral em que o autor buscava a condenação da ré ao custeio integral das despesas 
hospitalares decorrentes de sua internação de emergência. A ré, todavia, negou a 
internação e o procedimento, ao argumento de que não cumprido o prazo de carência de 
180 dias para custeio das despesas médico-hospitalares. 
Trata-se, portanto, de relação jurídica regida pelas normas do Código de Defesa do 
Consumidor, de acordo com a Súmula nº 608/STJ (“Aplica-se o Código de Defesa do 
Consumidor aos contratos de plano de saúde, salvo os administrados por entidades de 
autogestão”). 
Desta forma, as cláusulas contratuais devem ser interpretadas em favor da parte 
vulnerável, qual seja, o beneficiário, visando estabelecer o equilíbrio do contrato. 
No presente caso, em que pesem as alegações da requerida, o relatório médico acostado 
permite concluir que o tratamento é de emergência que, conforme definição do artigo 35-
C, I, da Lei 9.656/98, são aquelas que “implicarem risco imediato de vida ou de lesões 
irreparáveis para o paciente”. 
Afinal, foge à razoabilidade, portanto, que somente o atendimento de urgência seja 
coberto, negando-se a internação que dele decorre, expediente que, não raro, coloca em 
risco à vida do consumidor. 
Desta feita, a negativa de cobertura sob alegação de vigência do período de carência se 
revela abusiva na espécie, por se tratar de procedimento de urgência, que determina 
prazo máximo de 24 horas de carência, conforme inteligência do artigo 12, V, c, da Lei n. 
9.656/1998, verbis: 
Art. 12. São facultadas a oferta, a contratação e a vigência dos produtos de que tratam o 
inciso I e o § 1o do art. 1o desta Lei, nas segmentações previstas nos incisos I a IV deste 
artigo, respeitadas as respectivas amplitudes de cobertura definidas no plano-referência 
de que trata o art. 10, segundo as seguintes exigências mínimas: […] 
V - quando fixar períodos de carência: […] 
c) prazo máximo de vinte e quatro horas para a cobertura dos casos de urgência e 
emergência. 
No mesmo sentido, o teor da Súmula 597 do Superior Tribunal de Justiça: 
Súmula 597: A cláusula contratual de plano de saúde que prevê carência para utilização 
dos serviços de assistência médica nas situações de emergência ou de urgência é 
considerada abusiva se ultrapassado o prazo máximo de 24 horas contado da data da 
contratação. 
A jurisprudência vem enfrentando a questão, sempre no sentido de considerar abusiva a 
prática, que viola, inclusive, o teor do disposto no artigo 51, do CDC. De fato, são 
consideradas nulas de pleno direito as cláusulas contratuais que estabeleçam obrigações 
consideradas iníquas, abusivas, que coloquem o consumidor em desvantagem exagerada, 
ou seja, incompatíveis com a boa-fé ou a equidade, previsão legal perfeitamente aplicável 
à espécie. 
Importante ressaltar, ainda, que a jurisprudência tem entendido, inclusive, que a 
Resolução CONSU nº 13/98 sequer “tem força suficiente para veicular restrição desta 
natureza, à disposição legal (art. 12, V, c, da Lei 9656/98) que, no caso é amplo, e não 
prevê, em nenhum momento, restrição ao atendimento de emergência para as primeiras 
12 horas” (TJSP, 3ª Câmara de Direito Privado, Apelação Cível nº 361.343.4.4/3).  
Caracterizada assim a responsabilidade da ré. 
Igualmente, vislumbra-se a ocorrência de dano moral na espécie concreta dos autos, haja 
vista ser evidente o sofrimento e decepção do autor que, embora adimplente no que lhe 
cabia, foi submetido à espera do tratamento que necessitava em situação de urgência, 
quando deveria ter sido autorizado pela ré.  
A situação, à evidência, gera ansiedade e angústia daquele que, sabendo estar acometido 
de grave doença e por isso mais fragilizado psicológica e emocionalmente - teme ainda 
não ter condições de custear o tratamento necessário ou mais adequado à recuperação de 
sua saúde e, eventualmente, à manutenção de sua vida. A situação extrapola a esfera do 
mero aborrecimento e o dano é provado in re ipsa. 
Está clara a falha na prestação do serviço, em desconformidade com os prazos 
estabelecidos pela legislação, a justificar o cabimento dos danos morais  
Assim, levando-se em consideração os parâmetros acima expostos e as circunstâncias 
peculiares do caso em análise, afigura-se razoável e proporcional majorar a compensação 
no patamar de R$ 10.000,00 (dez mil reais), quantia se encontra em consonância com os 
precedentes desta Câmara no julgamento de ações semelhantes. 
Ante o exposto, na forma do art. 932, IV, a e V, a, do CPC, conheço dos recursos, dando 
parcial provimento ao 1º apelo e negando provimento ao 2º, nos termos da 
fundamentação supra. 
Majoro os honorários advocatícios a 15% (quinze por cento) sobre o valor da condenação, 
nos termos do art. 85, § 11, do CPC. 
Publique-se. Intimem-se. Cumpra-se. 
São Luís, data do sistema. 
 
Desembargadora Maria Do Socorro Mendonça Carneiro 
Relatora"
